title,content,publish_time,source,url,crawl_time,category
千锤百炼 终成铁人,（来源：沈阳日报） 转自：沈阳日报 □马 骋 长风破浪会有时！辽宁铁人队冲超成功，绝不是一蹴而就。这支经历十年风雨的球队，通过千百次锤炼，才淬铁成钢。 2015年，辽宁铁人俱乐部前身沈阳城市建设足球俱乐部起步时，球队还只是业余联赛中的追光者，随后数年更在中乙赛场起起伏伏。升入中甲联赛后的2022赛季曾遭遇十轮不胜跌入降级区，喊出冲超口号的2024赛季更是欲速则不达，一度跌至倒数第三，不得不两度换帅……危急时刻，昔日“辽小虎”李金羽归来执教，为球队注入了强大的精神动力，让队伍找回昔日“东北虎”的雄风。 在辽宁铁人队千锤百炼的冲超历程中，“三昧真火”的淬炼为球队蜕变提供了巨大动能。首先，辽宁省和沈阳市在政策、资金上的巨大支持，成为球队的坚强后盾；其次，辽宁铁人俱乐部大幅增加投入，全队团结一心、奋力一搏；最后，全省球迷齐声呐喊，成为球队强大的精神支柱。 此次冲超成功的背后，是辽沈足球血脉的薪火相传。自从昔日辽宁宏运队退出职业联赛，这片曾孕育出无数足球人才的沃土，始终在等待新的旗帜。如今，辽宁铁人队终于让沉寂八年的辽沈足球重新站上中国男足顶级联赛的舞台。 当明年的中超赛场迎来辽沈足球久违的身影和呐喊时，辽宁铁人队将用努力再次证明：真正的铁人，从不怕困难；真正的足球热土，从未失去光芒！,2025-10-27 05:30:32,网易新闻,https://www.163.com/dy/article/KCRR8J5605568W0A.html,2025-10-28 08:21:30,体育
诺斯科娃六进决赛仅取一胜被称悲情女郎，10后少女创中国网球纪录,什么叫好运气抛弃你的时候连声招呼都不打？诺斯科娃这次在东京的遭遇，就是活生生的例子！ 今年亮相东京500赛的诺斯科娃，一直被外界认为是这站赛事最受幸运女神眷顾的女孩，在东京晋级决赛的过程让人羡慕又嫉妒，无论在谁看来都太顺了。除了对阵美国姑娘凯斯勒苦战三盘逆转获胜赢得有些辛苦之外，后面的比赛强度甚至被球迷和网友们打趣都不如训练课。 比如，对阵俄罗斯美女卡林斯卡娅，诺斯科娃刚在首盘送蛋卡林斯卡娅，还未在第二盘发力，俄罗斯美女就因伤退赛，导致诺斯科娃都没怎么流汗就挺进了四强。 如果说诺斯科娃进四强多少还费了些力气的话，那么她进决赛的方式则是直接躺赢。由于莱巴金娜已经锁定年终总决赛最后一张门票，当时外界就猜测哈萨克斯坦美女退赛的可能性极大，没想到最后还真的被这届神通广大的球迷和网友们猜中了，莱巴金娜退赛让诺斯科娃不战而胜，挺进了本赛季第二个500赛决赛。 可惜决赛对阵瑞士名将本西奇，诺斯科娃感觉像被幸运女神突然收走了身上的好运一般，最终被本西奇仅用时82分钟就以6比2和6比3轻松击溃，赛前极高的夺冠呼声最终沦为了捷克姑娘的声声悲。 诺斯科娃输球后，很快被球迷和网友们发生在她身上的另一件事，更显得捷克姑娘身上的悲情如长江之水滚滚而来。 捷克姑娘迄今为止一共六次打进了巡回赛决赛，只赢了一次，足以让人哭晕。 看到这组冷冰冰的数据后，先前外界很多人还批评诺斯科娃，以逸待劳都打不赢半决赛苦战2个多小时击败肯宁的本西奇，实在是有愧外界送她的“天才少女”头衔，现在才知道诺斯科娃输球可能真是命中和冠军缘太浅，也就没有那么难以接受了。 诺斯科娃唯一在决赛中笑到最后的比赛是2024年蒙特雷500赛，当时捷克姑娘对阵的是新西兰华裔姑娘孙璐璐，最终两盘横扫夺冠。 2023年阿德莱德500赛是因为运气不好，决赛遇到了萨巴伦卡输球便成了必然；2023年布拉格250赛决赛，坐拥主场优势输给日本姑娘日比野菜绪，最让外界意外；2025年终于在布拉格250赛打进决赛，最后却输给了同胞布兹科娃；2025年中网决赛对阵阿尼西莫娃，这场失利外界也没什么可说道的；这次在东京500赛输给本西奇，外界最意外，不知道诺斯科娃怎么回事，留给了外界一个难解之谜。 非常有意思的是，现在很多人同情诺斯科娃时，还意外提到了孙璐璐，将两人称为是打不散的姐妹缘分，在失意方面共进退。 诺斯科娃失意东京后，去年在蒙特雷输给捷克姑娘的孙璐璐在广网决赛的遭遇，同样让人有些唏嘘。 赛前外界在预测这场比赛时，孙璐璐是明显被看好的一方。只是谁也没想到，在输掉首盘抢七大战后，压力非但没有转化成孙璐璐的动力，反而成了压垮她斗志的那根稻草，在第二盘以2比6速败，再次与职业生涯首个巡回赛冠军擦肩而过。 相对于诺斯科娃和孙璐璐这对异国姐妹的悲情，中国金花上周有件事则不得不提，让很多人意外且开心，这份骄傲由15岁的深圳籍少女孙心然倾情呈现。 孙心然这次凭借青少年排名参加ITF 15K沙姆沙伊赫站赛事，半决赛挑落头号种子埃米尔首进成人赛决赛，已经引起了不少人对这位小姑娘的关注。没想到在决赛，这位10后的中国小花更是中国网球带来了一份意想不到的大惊喜，拿到了这站赛事的冠军。 也许这个冠军对其他人来说级别太低，甚至根本不值得一提，但是对于15岁的孙心然来说，却具有双重意义，除了让她首次获得成人赛冠军之外，还创下了中国网球一项新的纪录：成为夺得成年赛首冠最年轻的中国网球运动员。 孙心然上周成为中国金花军团的新骄傲后，球迷和网友们都希望她继续努力，未来在重大赛事给大家带来更大的惊喜，让世界见证中国网球的新势力！（来源：网球之家 作者：月亮河的星空）,2025-10-27 13:16:42,网易新闻,https://www.163.com/dy/article/KCSLU24505298CTE.html,2025-10-28 08:21:32,体育
打疯了！文森特不到7分钟狂轰18+5三分 詹姆斯开吹：要疯了,北京时间10月16日，在NBA季前赛湖人背靠背第二场主场对阵独行侠的比赛，在三巨头均缺席的情况下，文森特首节仅出场6分41秒就狂轰5记三分，一人独得18分大爆发，也是引发詹姆斯与湖人记者Daniel Starkand疯狂开吹。 由于湖人罕见在季前赛就遭遇背靠背比赛，在詹姆斯继续受困于坐骨神经痛休战之外，湖人还轮休了东契奇、里夫斯、艾顿、斯马特、拉拉维亚等主力球员。 在如此情况下，文森特首发登场迎来大爆发，他在首节开局就疯狂连中5记三分，还博得罚球3中3。文森特在首节仅登场6分41秒，他贡献8中5的投篮表现，其中外线三分7中5，外加罚球3中3，一己之力狂轰18分1助攻表现，成为湖人的进攻箭头人物。 文森特的出色表现，让詹姆斯也是通过社媒点赞表示：“GV（文森特）要疯了！嘶~火火火火火火火火火。” 湖人随队记者Daniel Starkand也是通过社媒开吹：“当你有文森特时，谁还需要东契奇、詹姆斯和里夫斯啊！” （文/醉卧浮生）,2025-10-16 11:12:49,网易新闻,https://www.163.com/dy/article/KC04F3KU0529RKNN.html,2025-10-28 08:21:34,体育
斯卢茨基：可能队员得知其他对手的赛果后，背负较大心理压力,雷速体育10月26日讯 中超联赛第28轮，上海申花2-2大连英博，赛后，上海申花主教练斯卢茨基出席新闻发布会。 斯卢茨基：“去年在主场我们也曾遭遇过相似的一幕，对手可能确实没有那么强大，但是我们没有能够取胜。我想可能是因为队员在得知其他对手的赛果后，内心上背负了较大的心理压力导致了发挥失常，今天我们很多队员都没有表现出自己应有的水平。今天这场比赛可以说是我们本赛季发挥最差的一场比赛，对于争冠球队来说，对于这样关键时刻的抗压经验积累我认为是一门必修课，而我们今天再次付出了学费。”,2025-10-26 23:10:10,网易新闻,https://www.163.com/dy/article/KCR5G4880529DS7F.html,2025-10-28 08:21:37,体育
难以置信！湖人单场狂罚46球：全场嘘声四起，一人超对手全队,北京时间10月27日，NBA常规赛，湖人在客场127-120击败国王，取得2连胜。这场比赛湖人在没有詹姆斯和东契奇的情况下，依靠着里夫斯的出色表现，依然赢下了比赛。可在比赛结束之后的采访中，国王球员德罗赞直接来了一句：“难以置信！” 德罗赞为何会这么说呢？因为是湖人这一场比赛获得了高达46次罚球，反观国王则只有18次。随后德罗赞也是说道：“他们在罚球线排着队罚了一整晚，这会打乱我们的节奏，这挺让人泄气的，尤其是当我们努力打球，努力竞争的时候。因为犯规麻烦，轮换阵容里的人进进出出，很难找到节奏，因为总是让他们站上罚球线，给他们节奏。” 国王主帅克里斯蒂谈到这个也是直呼太疯狂了，真的太疯狂了。 全场比赛国王被吹罚了26次犯规，其中埃利斯只打了18分钟不到就6犯下场，内线核心小萨博尼斯5次犯规，替补席上的蒙克和考德威尔则都拿到4次犯规。由于不断走上罚球线，比赛也是断断续续，本以为这是湖人主场的，一看居然还是国王主场，每当湖人球员走上罚球线，全场就爆发出嘘声，甚至还在骂裁判。 而在这当中，湖人里夫斯一人就获得了高达22次罚球，而他也是迎来了生涯之夜。全场22投11中，三分球9中5，22罚21中，爆砍生涯新高的51分，外加11篮板9助攻，打出了一场史诗级别的表现。可由于罚球数的关系，也遭到了很多质疑，美国网友就直言：“里夫斯这待遇完美，国王队连呼吸都算犯规，这联盟彻底没救了。” 里夫斯一人的罚球数比国王全队还多4次，这就有些疯狂了。要说国王全都在三分线外出手也不全是的，全场他们出手了101次，其中43次三分出手，可他们全队获得罚球数最高的也就6次。来自替补席上的威少，只不过命中率不高，只有6罚2中。德罗赞只有1次，拉文则是4次，施罗德1次。,2025-10-27 13:07:54,网易新闻,https://www.163.com/dy/article/KCSLCRDS0529C2OT.html,2025-10-28 08:21:39,体育
日进斗金，西西帕斯参加沙特六王争霸赛每分钟赚2万美元,10月16日，在沙特利雅得举办的六王争霸赛第一日，西西帕斯0-2（2-6、3-6）脆败于辛纳，比赛耗时76分钟，赚取了150万美元出场费，每分钟净赚将近2万美元。 此外，兹维列夫仅抵抗了59分钟就以0-2（3-6、4-6）败于弗里茨，每分钟狂赚2万5千美元。 “六王争霸赛”的冠军奖金冠军最高可获得600万美元奖金。而美网男单冠军奖金为500万美元，澳网奖金466万美元，温网399万美元，法网293万美元。,2025-10-16 15:03:25,网易新闻,https://www.163.com/dy/article/KC0HLLBA0549BAP0.html,2025-10-28 08:21:42,体育
FIFPRO男足年度阵容候选：登贝莱、亚马尔领衔，梅罗在列,雷速体育10月27日讯 FIFPRO（国际职业足球运动员联合会）官方公布了2025年度男足最佳11人候选名单，登贝莱、姆巴佩、哈兰德领衔，梅西、C罗、亚马尔均在列，最终结果将在11月3日公布。 门将：多纳鲁马、库尔图瓦、阿利松 后卫：阿什拉夫、马尔基尼奥斯、萨利巴、库巴西、努诺·门德斯、阿诺德、范戴克 中场：贝林厄姆、德布劳内、莫德里奇、若昂·内维斯、帕尔默、佩德里、巴尔韦德、维蒂尼亚 前锋：登贝莱、哈兰德、姆巴佩、梅西、拉菲尼亚、C罗、萨拉赫、亚马尔 FIFPRO最佳阵容由来自世界各地的职业足球运动员投票选出，这是唯一一个完全由球员投票选出的全球性足球奖项。 FIFPRO及其附属球员联盟会发布专属链接，让来自职业足球俱乐部的球员能够访问数字投票平台。 球员们会在门将、后卫、中场和前锋四个位置中各自选出他们认为最杰出的三名球员。 在各自位置上获得最多票数的门将、三名后卫、三名中场和三名前锋将入选最佳阵容，而最后一个名额分配给剩余候选者中票数最高的非门将球员。 2025年FIFPRO男足最佳阵每个位置的评选基于他们在2024年7月15日至2025 年 8月3日期间的表现。球员必须在此期间参加至少30场正式比赛才有资格进入候选名单。 门将：埃德森 后卫：卡瓦哈尔、吕迪格、范戴克 中场：德布劳内、罗德里、克罗斯、贝林厄姆 前锋：姆巴佩、哈兰德、维尼修斯,2025-10-27 22:13:04,网易新闻,https://www.163.com/dy/article/KCTKK9R50529DS7F.html,2025-10-28 08:21:45,体育
TA：皇马将对卢宁红牌上诉；部分球员认为下维尼修斯不合适,雷速体育10月27日讯 据The Athletic报道，皇马将对卢宁的红牌提出上诉；部分皇马球员认为阿隆索换下维尼修斯并不合适。 维尼修斯与阿隆索之间的关系一直不算融洽。阿隆索曾在皇马与大巴黎的世俱杯半决赛前，计划将维尼修斯安排为替补，但由于阿诺德受伤，最终维尼修斯被安排在右边锋位置上出场。然而，他在这个位置上表现不佳，球队以0-4惨败，这让他对阿隆索的安排产生了不满。 维尼修斯的团队在8月初就曾预测到，阿隆索的执教将使本赛季变得相当困难。赛季至今，维尼修斯仅在10场首发比赛中完成了3次打满全场，而在13场比赛中有3次未能首发。 对于维尼修斯的不满，皇马队内的一些人对此表示理解，认为他在比赛中的表现并不差，甚至为球队赢得了一个早早被VAR取消的点球。许多队友和工作人员也认为，阿隆索在如此重要的比赛中将维尼修斯换下并不合适。 在赛后混乱中，皇马替补门将卢宁也卷入了冲突。当时，卢宁站在维尼修斯身旁并试图保护他。当巴萨的球员走向维尼修斯时，卢宁站到了他们面前，并用身体挡住了他们。此举引发了更多的混乱，最终卢宁被出示红牌。 据悉，皇马对这一判罚表示不解，并称将对红牌提出上诉，但来自现场的消息称，卢宁的举动是出于保护维尼修斯的本能反应。,2025-10-27 18:10:26,网易新闻,https://www.163.com/dy/article/KCT6O0BF0529DS7F.html,2025-10-28 08:21:48,体育
半场“轰”进4球，山西男足胜利收官,山西男足赛后与球迷欢庆胜利。 10月25日，2025赛季中乙联赛决赛阶段保级组比赛落下帷幕。在最后一轮比赛中，山西崇德荣海队主场4比2击败广西队，以一场胜利为本赛季画上句号。 上一轮比赛，山西崇德荣海队客场以2比1力克武汉队，提前一轮保级。已无成绩压力的山西崇德荣海队，本场比赛主动进行阵容轮换，李泽宇、孔令祎等年轻球员本赛季首次代表球队出场。 本场比赛过程跌宕起伏，两队各踢半场好球。广西队开场仅7分钟便率先取得进球，随后又在上半场结束时利用前场任意球破门，取得2比0的领先优势。 易边再战，山西崇德荣海队进行阵容调整。此举很快收到效果，战至比赛第47分钟，谭天澄小角度挑射破门，将比分改写为1比2。6分钟之后，张炜再次破门，山西崇德荣海队扳平比分。 连入两球之后，山西崇德荣海队士气大涨，牢牢掌握场上主动权。第58分钟和第85分钟，苏顺、谭天澄接队友精妙助攻又进两球，将比分锁定为4比2。 此战过后，山西崇德荣海队以8胜11平11负积35分的战绩，结束了本赛季中乙联赛征程。赛后，山西崇德荣海足球俱乐部特意举办了一个简短的答谢仪式，为本赛季“最佳球迷”颁发了奖状及奖品。（记者 杨尔欣 文/摄） 来源：太原晚报,2025-10-27 08:58:08,网易新闻,https://www.163.com/dy/article/KCS74NA30552FDTY.html,2025-10-28 08:21:51,体育
亦喜亦忧！辽篮三连胜令人兴奋，但是U22男篮正为人数不够而发愁,亦喜亦忧！辽宁全运男篮成年组热身赛三连胜令人兴奋，但是U22男篮3位临时工或将“拒绝”参加决赛，加上4将禁赛，正在为人数不够而发愁！ 辽篮主教练杨鸣所执教的辽宁全运男篮成年组队伍，在热身赛上分别以83-74击败强大的四川男篮、95-93险胜北京男篮、106-77大胜山东男篮豪取三连胜令人十分兴奋。因为这支看上去就仅剩赵继伟这一位大牌球星的辽宁全运男篮，并没有外界想象的那么弱。原因大概是，这支队伍是由纯辽宁籍球员组成，大家都没有其他任何不一样的想法，而是坚定的心往一处想，劲往一处使，真正做到了攥指成拳，所以才迸发出强大的能量。 全运男篮成年组决赛11月4日就正式开赛了，辽宁全运男篮成年组作为卫冕冠军，也一定会拼尽全力继续争冠，力争获得三连冠。虽然说起来容易做起来难，但是谋事在人成事在天，只要努力了，结果一定不会差。 然而，预赛5连胜，同样志在争冠的辽宁U22男篮，目前却遇到了非常大的问题。 首先是，辽宁自己培养的四名悍将张峻豪、黄秋实、邢维皓和李亚轩，都是因为被禁赛而没有办法参加11月10日开始的U22组别的决赛。 黄秋实和张峻豪各禁赛三年已经去参加西班牙U22联赛去了，邢维皓和李亚轩虽然只是各禁赛8场，但是由于在全运会决赛前并没有可以抵消禁赛场次的比赛，而全运会决赛还没等到他俩的禁赛结束就完事了，所以他们也无法参加U22男篮的决赛。 光禁赛，就让辽宁U22男篮一下子少了4名球员。 而辽宁U22男篮所签的3名临时工王俊杰、赵维伦和淡厚然，据悉也因为和他们所参加的NCAA联赛的赛程重叠，或将“拒绝”继续代表辽宁U22男篮参加全运会决赛。这样算下来，辽宁U22男篮已经少了7名球员了。加上正在日本B3联赛打球的任序航，总共8名球员离开了球队。 而辽宁U22男篮的报名球员人数总共是16人，那么也就意味着，只剩8名球员可以参加比赛。但是，注册球员人数少于10人是没有办法参加比赛的，那怎么办呢？辽宁U22男篮正在为人数不够而发愁。 我觉得，辽宁自己培养的球员任序航请个两周左右的假回来参加比赛应该没问题。关键是王俊杰、赵维伦和淡厚然他们仨，因为王俊杰今年夏天在国家队的表非常好，所以让他们这些旅外的有天赋的年轻球员身价大涨。说白了人家现在就是坐地起价，你要是另外加钱，加到他们满意为止，回来打全运会也许还是有回旋的余地的？说赛程冲突，应该说只是一种借口。 当年姚明在NBA打球期间，遇到一些重要的赛事，不也回来过吗？更何况他们只是打NCAA联赛，请20天假难道真的请不到吗？ 当然，人家是职业球员，追求个人利益最大化无可厚非。只是有一点不太明白，合同应该是两年前就已经签了，但是现在又说不回来了，这个怎么解释呢？不过，合同的具体细则是什么别人不知道，存不存在违约目前暂不清楚。但是，现在纠结这些好像已经不是太重要了，当务之急就是要想办法把参赛人数凑齐，先把燃眉之急给解决了。 以上就是辽宁篮球亦喜亦忧的两个消息。希望辽宁全运男篮成年组队伍能够如愿以偿，同时也希望辽宁U22男篮能够尽快找到解决问题的办法，争取参加比赛，并且取得好成绩！,2025-10-20 01:16:19,网易新闻,https://www.163.com/dy/article/KC9BDIA60549AV2P.html,2025-10-28 08:21:54,体育
