title,content,publish_time,source,url,crawl_time,category
空砍40分14板9助，字母哥历史首人！名嘴支招勇士6换1卖4首轮抢人,空砍40分14板9助超级大号准三双，字母哥成历史首人雄鹿仍输球！名嘴支招勇士队6换1一口气卖掉4枚首轮签抢人。 空砍40分14板9助 NBA常规赛争夺继续，在开季前两场先后击败奇才、猛龙两支实力相对不佳的鱼腩拿下2连胜后，雄鹿队前往克利夫兰挑战强敌骑士，最终雄鹿队以113-118败下阵来无缘3连胜。 核心字母哥本场延续神奇表现，以20中14的夸张命中率爆砍40分14篮板9助攻2抢断2盖帽全能数据。 无奈的是身旁队友面对强强对话直接暴露出成色不足问题，名嘴也果断支招勇士队6换1追求字母哥升级三巨头全力冲击冠军。 字母哥成历史首人 字母哥如此神奇的表现，也是其开赛至今夸张表现的缩影，新赛季至今3场比赛，字母哥一共砍下108分48篮板21助攻，场均36分16板7助。 成为NBA历史上首位在开季前三场拿下至少100分40篮板15助攻的球员。 更为夸张的是，字母哥连续三场比赛在交出华丽数据的同时，还保持着超过60%的进攻效率。 这让其成为NBA历史上首位在开季前三场至少以60%命中率拿下至少30分10篮板5助攻的球员。 本场比赛再次以至少70%命中率砍下40+得分后，也让字母哥领跑NBA历史该项数据表现纪录。 无奈的是，字母哥没有得到足够的帮助，这也是雄鹿队休赛期裁掉利拉德后的尴尬现状。 哪怕雄鹿队引进了一批白菜价高性价比角色球员，同时押宝特纳，但依旧无法解决字母哥身旁缺少合理二当家的处境。 按照目前NBA的竞争激烈程度，雄鹿队如此糟糕的阵容完全是在浪费字母哥的巅峰期，而后者又在过去几个赛季明确表态自己迫切想要得到第二个冠军，还因此在休赛期陷入交易传闻，如果雄鹿队没有其他奇兵涌现，那么随着赛程的推进，字母哥势必会在交易截止日再度陷入离队传闻。 名嘴支招勇士队抢人 面对这样的局面，FOX体育名嘴Colin Cowher也在节目中建议勇士队在交易截止日前尝试通过6换1交易追求字母哥，以帮助库里全力争夺第五个冠军。 潜在交易支招如下 勇士得到：字母哥； 雄鹿得到：巴特勒+库明加+4枚首轮签。 哪怕勇士队开季表现不俗，但如果有机会得到字母哥，相信金州管理层不会有丝毫的犹豫，过去几个赛季勇士队一直都在密切关注字母哥的动向。 即便巴特勒与库里形成了良好的化学反应，库明加也开窍连续打出亮眼表现，但与字母哥这个级别的超级巨星相比，两人完全可以成为被牺牲的对象。 尤其是库里步入生涯末期，本赛季为争夺第五个冠军连续打出傲人表现的大背景下，无论是从帮助库里追求第五冠赢在当下的角度考虑，还是为了后库里时代寻找新的核心，字母哥都将是绝佳的人选。 对于字母哥来说，加盟勇士队也是绝佳的选择之一，联手库里势必会让字母哥在进攻端获得更好的进攻空间，加上勇士队本赛季展现出的竞争力，字母哥将立刻获得争冠机会。 除此之外，相比于寒冷的小球市密尔沃基，过去10年建立王朝的金州勇士队拥有一批忠实的拥趸，当地球市与未来发展也远非密尔沃基能比，将最大化字母哥的影响力，并且帮助其建立场外商业版图。,2025-10-27 11:47:52,网易新闻,https://www.163.com/dy/article/KCSGDM380529K9AI.html,2025-10-28 08:18:26,体育
开拓者揭幕战变阵：霍勒迪阿夫迪亚等五人首发，格兰特打替补,雷速体育10月22日讯 据体育记者Sean Highkin最新报道，开拓者明天对阵森林狼的赛季揭幕战，他们的首发阵容五人分别是朱·霍勒迪、谢顿·夏普、图玛尼·卡马拉（Toumani Camara）、丹尼·阿夫迪亚（Deni Avdija）、多诺万·克林根（Donovan Clingan）。 与之前相比，最大的变化就是球队核心杰拉米·格兰特被调整到了替补席，这将是他自2022年加盟开拓者以来，首次以替补身份出战。而上一次他打替补，还是在2019-20赛季效力掘金时期。 在上月的媒体日上，当被问到是否可能以替补身份出战时，格兰特表示：“我并不真有这样的预期。”不过他随后澄清称，即使真的不是首发，他也不会感到不满，并表示“没问题”。 Sean Highkin在其报道中提到：“考虑到卡马拉与阿夫迪亚的崛起，开拓者将格兰特移出首发阵容并不令人意外，但这仍是本赛季上半程值得关注的情况之一。这位老将前锋在未来可能成为交易候选人，但他目前的合同还剩3年，总额高达1.026亿美元，同时又经历了上赛季因伤仅出战47场的困境，因此他在交易市场上的价值目前相当有限。” 现年31岁的格兰特是队内薪资第二高的球员，仅次于霍勒迪。他的合同至少还剩两年，并拥有2027-28赛季的球员选项。然而，随着卡马拉与阿夫迪亚的迅速成长，格兰特在球队轮换中的位置已被这两位年轻前锋超越。卡马拉刚刚与球队签下了一份为期四年的续约合同，合同期至2029-30赛季；阿夫迪亚的合同也还剩三年保障期。 格兰特是在2022年休赛期从活塞被交易至开拓者的，自那以后，他为球队出战的164场比赛全部首发，场均得到18.9分、3.9个篮板和2.5次助攻，出场时间为34.1分钟。,2025-10-22 06:36:31,网易新闻,https://www.163.com/dy/article/KCF31QQ10529DS7F.html,2025-10-28 08:18:28,体育
科比之后最强新秀诞生，状元弗拉格写史上第2人神纪录,赛季开局苦吞2连败的达拉斯独行侠，今日在主场迎战多伦多猛龙，靠着浓眉戴维斯25分、10篮板领军，加上本赛季选秀状元弗拉格22分、4篮板、4助攻携手出击，以139比129赢得本赛季首胜。 弗拉格单场得分突破20分大关且0失误的表现，也让他成为科比之后，史上第2位年仅18岁球员，能在NBA写下这样的神数据。 打开网易新闻 查看精彩图片 206公分的高大身材，且被视为联盟新一代白人希望的弗拉格，赛季开局就被独行侠赋予先发控卫重任，至今表现也渐入佳境，今日对上猛龙之战，弗拉格全场先发出赛28分54秒，14投8中拿下22分、4篮板、4助攻、1盖帽，且全场没有任何失误发生。 弗拉格也成为继洛杉矶湖人已逝传奇球星科比之后，史上第2位年仅18岁（弗拉格目前年纪为18岁又310天），就能在NBA赛场写下单场至少拿20分，且没有任何失误的新秀，前途可说无可限量。 今日除了写下神纪录外，弗拉格也再次贡献精彩爆扣美技，他在一次快攻展现惊人运动能力，加速直捣对手禁区，单臂升空强势爆扣，也让外界再次见识到这位超级新人的强势风采。,2025-10-27 16:58,网易新闻,https://m.163.com/news/article/KCT2KSL60549VVJM.html,2025-10-28 08:18:31,体育
东契奇勒布朗缺席里夫斯贡献51+11+9，湖人险胜国王艾顿22+15,北京时间10月27日，NBA新赛季常规赛继续进行，洛杉矶湖人队（2胜1负）拿到连胜。在东契奇和勒布朗缺席的情况下，里夫斯挺身而出，狂砍51分、11个篮板和9次助攻，他率队末节重新领跑，湖人队在客场以127-120战胜萨克拉门托国王队（1胜2负）。湖人队拿到2连胜。 湖人队的里夫斯得到51分、10个篮板和9次助攻，艾顿得到22分和15个篮板，八村塁得到18分，拉拉维亚得到11分和6个篮板，斯马特得到11分和5次助攻，范德比尔特得到9分和4个篮板。国王队的拉文得到32分和4个篮板，德罗赞得到21分和6个篮板，威少得到18分、6个篮板和6次助攻，施罗德得到18分和12次助攻，蒙克得到15分，萨博尼斯得到10分、14个篮板和4次助攻。 湖人队的东契奇因左手手指扭伤、左小腿挫伤将缺席至少一周。勒布朗也继续缺席，斯马特顶替进入首发。开场后不久拉文三分命中，国王队取得领先。艾顿独取5分，八村塁也贡献4分，他们率队打出11-2的小高潮，湖人队以13-7反超。埃利斯回敬三分，里夫斯连得5分扩大优势。施罗德打3分缩小差距，艾顿空接扣篮，里夫斯突破得分，首节还有4分30秒时湖人队以27-19领先。德罗赞这时站出来连进三球帮助球队追近，范德比尔特两罚全中，拉拉维亚右翼命中三分，首节结束时湖人队以36-27领先9分。八村塁单节得到10分，拉文得到11分。 蒙克和威少合取7分开始第二节，国王队将差距缩小到2分。斯马特两罚回应，德罗赞连拿6分，本节进行了3分30秒时国王队以40-38反超。里夫斯三分止血，威少外线找到手感，连进2个三分球，国王队以46-43领先。克内克特、斯马特和里夫斯轮流得分帮助球队夺回领先，施罗德和蒙克还击5分，里夫斯连造犯规罚进四球，艾顿也两次篮下得分，半场前1分30秒时湖人队以59-57再次领跑。德罗赞再进三分，艾顿和里夫斯拿下3分，拉文上篮得手，半场战罢两队以62平握手言和。 湖人队的里夫斯上半场得到21分、4个篮板和5次助攻，艾顿得到13分和4个篮板，八村塁得到10分；国王队的德罗赞得到17分和4个篮板，拉文得到13分，威少得到11分和5个篮板。 艾顿连得4分率队以8-3的攻击波开始第三节，湖人队重新领跑。施罗德还击三分，八村塁和里夫斯拿下4分，但文森特因为有些受伤离场返回更衣室。这之后湖人队突然失准，连续投篮打铁，拉文开启攻击模式连拿8分，国王队以76-74再次反超。斯马特和范德比尔特均两罚一中追平，蒙克替补登场连中2个三分帮助球队再次领跑，里夫斯保持攻击性一人独得6分，第三节还有2分55秒时湖人队以86-84领先。蒙克两罚扳平，里夫斯又得5分再次拉开，德罗赞跳投命中，拉拉维亚两罚全中，三节结束时湖人队以95-90领先。 威少三分中的，他率队以8-0的反击波开始第四节，国王队反超3分。斯马特单打止血，萨博尼斯三分回应，里夫斯回到场上立即开火，连中2个三分球，湖人队以103-101重新领先2分。国王队之后进攻连续打铁，艾顿勾手得分，里夫斯三分中的，湖人队以108-101领先7分。拉文三分止血，八村塁命中两球，拉拉维亚弧顶投中三分，第四节还有4分15秒时湖人队以117-106领先。国王队没有放弃努力，连追6分，拉拉维亚打3分回应，拉文命中三分结束7-2的反击波，第四节还有1分30秒时国王队追至119-122。急于追分的国王队连续打铁，里夫斯四罚全中，湖人队以126-119领先。国王队之后无力回天，他们以120-127落败。 湖人队首发阵容：里夫斯、文森特、斯马特、八村塁、艾顿 国王队首发阵容：施罗德、埃利斯、拉文、德罗赞、萨博尼斯,2025-10-27 11:40:58,网易新闻,https://www.163.com/dy/article/KCNVUJMD0529AL9S.html,2025-10-28 08:18:34,体育
鲁尼：范戴克和萨拉赫都没有引领利物浦，感觉肢体语言不对劲,雷速体育10月27日讯 鲁尼在个人的节目中表示，利物浦目前面临缺乏领导力的问题，范戴克和萨拉赫都没有发挥领袖作用。此外，鲁尼还点评了曼联以及阿森纳的情况。 鲁尼：没有人会想到利物浦遇到这样的困境，这一切来得太快了，对他们的打击非常大， 我认为他们很难找到办法摆脱这样的困境。 斯洛特和队内的领袖需要迅速解决问题，范戴克和萨拉赫已经签署新合同，但我不认为他们在本赛季引领球队前进。 我认为肢体语言会说明很大的问题，我们看到他们两个的肢体语言有点不同，他们是利物浦队内最重要的两名球员，如果他们的肢体语言不对劲，那会影响到每个人。 我的判断或许有误，不过，如果我是利物浦球迷或者主教练，这会是让我非常担心的问题。 利物浦目前处境不佳，当那样的情况发生的时候，我无法解释其中的原因，这很难说，你不知道如何走出困境。 你在丢球之后会想着重新再来，但利物浦的问题很难解决。最好的办法就是简化一切，在球场上踢得简洁一些。通常情况下，如果你签下更好的球员，你会赢下比赛，但事实上没有那么容易。 鲁尼：阿森纳目前的阵容已经足够出色，他们已经有过接近拿到英超冠军的经历，但我认为他们如今已经准备好了。 如果阿森纳在本赛季没有夺得英超冠军，你们或许会看到俱乐部选择换帅。 鲁尼：姆伯莫的活力、积极跑动以及比赛欲望都是作为一名曼联球员需要具备的特点，我确实说过我曾经不确定他是否能够为曼联效力，但我认为他已经证明自己属于曼联。 姆伯莫的表现非常稳定，我认为这是关键，如果你持续出现在正确的位置上并且获得进球机会，你就会在单赛季打进20球。,2025-10-27 20:48:14,网易新闻,https://www.163.com/dy/article/KCTFOV3R0529DS7F.html,2025-10-28 08:18:36,体育
西部第一！雷霆大胜老鹰 亚历山大30+4+5霍姆格伦31+12,北京时间10月26日，NBA常规赛卫冕冠军雷霆客场对阵老鹰，其中老鹰是背靠背第二场。亚历山大三节17中12高效轰下30+4+5，引领雷霆持续压制老鹰逐步扩大20+优势，最终雷霆117-100战胜老鹰收获3连胜高居西部第一领跑。 数据统计 雷霆：亚历山大三节30分4篮板5助攻，霍姆格伦6记三分31分12篮板3抢断，哈尔滕施泰因14分10篮板，米切尔14分7篮板7助攻。 老鹰：特雷杨15分10助攻，沃克3记三分17分，盖耶11分，奥孔古11分12篮板，纽厄尔12分10篮板，克雷伊奇13分。 比赛回顾 雷霆新赛季前两场，连续通过双加时险胜火箭与步行者，老鹰上一场111-107客场险胜魔术获得首胜。本场雷霆缺少杰伦、卡鲁索等多位球员，老鹰也缺少波尔津吉斯、里萨谢等多位球员。首节开局双方缠斗至10-10，并在之后继续维持14-14，霍姆格伦外线三分开火率队逐步扩大22-16领先优势。老鹰反扑追到差3分，雷霆连得7分扩大10分优势，老鹰继续反扑追到个位数差距，首节结束雷霆31-26领先老鹰。霍姆格伦首节三分4中4得到14+4，老鹰没有球员得分上双。 次节比赛，亚历山大连攻带传率队扩大40-29领先优势，老鹰连追5分，雷霆继续保持压制模式。双方展开拉锯战缠斗，特雷杨引领老鹰内外开花反扑，雷霆逐步被追到56-55仅领先1分。雷霆再得4分，双方单节维持29-29，上半场结束雷霆60-55领先老鹰。前两节比赛，雷霆3人得分上双，霍姆格伦16分、亚历山大13分与哈尔滕施泰因10+6，特雷杨10分8助攻与沃克12分。 中场休息回来，双方核心球员表现存在巨大差异，亚历山大第三节迎来大爆发表现，他单节狂轰17分无可阻挡，特雷杨第三节0分仅送出1次助攻。霍姆格伦也是内线给力表现，雷霆内外开花第三节打出39-25净胜14分，三节结束雷霆扩大99-80领先老鹰。前三节比赛，亚历山大17中12轰下30分，霍姆格伦23+9，引领雷霆4人得分上双，特雷杨10+9引领老鹰4人得分上双。 雷霆带着19分领先优势进入第四节比赛，末节开局雷霆继续压制扩大111-87领先24分优势。雷霆之后继续掌控局势保持20分左右优势，比赛已经提前失去胜负悬念，双方均是逐步换下主力球员，最终雷霆轻松大胜老鹰豪取3连胜，高居西部第一领跑。 双方首发 雷霆：多尔特、霍姆格伦、哈尔滕施泰因、华莱士、亚历山大 老鹰：沃克、盖耶、奥孔古、丹尼尔斯、特雷杨 （文/醉卧浮生）,2025-10-26 09:53:12,网易新闻,https://www.163.com/dy/article/KCPNO3IE0529RKNN.html,2025-10-28 08:18:38,体育
无缘全运？王俊杰赵维伦等3人缺阵辽篮U22恐不全是赛程冲突,据媒体消息，王俊杰、赵维伦和淡厚然三名正在NCAA征战的中国球员，将会因为赛程冲突进而无法代表辽宁U22男篮出战全运会决赛阶段。 但是仔细想来，这三人无法代表辽宁U22出战全运会决赛阶段，恐怕不是赛程冲突这么简单。 王俊杰和赵维伦代表辽宁U22男篮参加了全运会预赛，他们帮助球队取得了全胜的好成绩，而淡厚然则没有从西雅图大学回来出战全运会预赛。 所以，这块U22男篮金牌被外界看做是辽宁手拿把攥的，王俊杰等三人如果来不了，这是不是太儿戏了？毕竟，全运会对于省市体育局来说可是关系到升迁加薪的啊。 但是考虑到之前在全国U21青年联赛中，辽宁和山东群殴的事情，两队都有大量球员遭到场次不等的禁赛，那么，这次王俊杰等人缺席U22辽篮就变的容易理解了。 既然辽宁U22大量球员都处于禁赛期，导致无法出战全运会决赛阶段，成绩根本就没有保障，那何不顺水推舟让王俊杰等人别回来了，专心打NCAA呢？ 归根到底，还是那次辽鲁群殴引发了的连锁效应，他们这一打，影响是方方面面的，不全是球员个人的篮球生涯，甚至会影响到更高层的人士变动。 值得一提的是，张峻豪和黄秋实已经前往西班牙，参加那里的U22联赛。,2025-10-20 09:42:11,网易新闻,https://www.163.com/dy/article/KCA8PPPI0529B6P0.html,2025-10-28 08:18:42,体育
官方：药厂中场费尔南德斯左膝受伤，预计缺席7-8周,雷速体育10月27日讯 北京时间10月27日，德甲俱乐部勒沃库森官方宣布，球队中场费尔南德斯在上一轮联赛中左膝韧带受伤，将会缺席一段时间。 勒沃库森队在未来几场比赛中将缺少中场球员费尔南德斯，这位阿根廷中场在10月26日2-0战胜弗赖堡的德甲联赛中左膝韧带受伤，无需进行手术。 费尔南德斯将在勒沃库森训练与康复中心接受进一步的治疗，这位23岁的球员预计将缺席7周至8周。（公告完） 按照缺席7周估计，这位阿根廷球员将会至少缺席勒沃库森接下来的10场比赛，包括联赛对阵拜仁、多特、莱比锡和欧冠对阵本菲卡、曼城、纽卡的关键战。,2025-10-27 23:58:45,网易新闻,https://www.163.com/dy/article/KCTQLQDK0529DS7F.html,2025-10-28 08:18:44,体育
当众辱骂阿隆索！1.5亿欧熊皇惹怒老佛爷+更衣室 皇马准备处罚他,由于不满阿隆索将其提前换下，25岁的维尼修斯在今日凌晨的国家德比中公开辱骂阿隆索，造成了非常严重的负面影响。西班牙多家媒体表示，皇马高层准备处罚巴西巨星。 本轮联赛，皇马在主场迎战巴萨，维尼修斯首发出场。上半场，维尼修斯表现不俗，多次用犀利的突破给巴萨防线施压，并制造了皇马的第二个进球。第72分钟，维尼修斯被提前换下。 离场时，维尼修斯非常生气。走到阿隆索身边的时候，他冲着对方喊道：“滚XX的。”、“总是换我。我要离开球队！现在就要走，这样更好！”随后，他直接走入更衣室。6分钟后，他从更衣室又返回到替补席。 据悉，阿隆索换下维尼修斯是不满他的防守态度。此外，《马卡报》透露维尼修斯从更衣室回到替补席并不是主动的，而是皇马门将教练将其劝回的。本赛季，维尼修斯在阿隆索麾下失去了昔日的绝对核心地位，他对此感到很失落。 这已经不是维尼修斯本赛季第一次在被换下后冲着阿隆索发脾气。《世界体育报》表示，皇马的高层和更衣室都对维尼修斯的行为很不满，甚至是非常恼火。“老佛爷”弗洛伦蒂诺对维尼修斯很生气，这可能会影响巴西人在皇马的未来。 西媒表示，皇马正在考虑处罚维尼修斯。维尼修斯面临着5.3万欧的经济罚款，也可能被停职停薪2-10天。皇马内部觉得有必要“让他吸取教训”。,2025-10-27 21:37:29,网易新闻,https://www.163.com/dy/article/KCTIJ41805566VBM.html,2025-10-28 08:18:47,体育
打成大腿！中国男篮正式迎来“欧式中锋”，近20年内最强传统内线,2025-26赛季西班牙乙级联赛第5轮继续进行，一场焦点大战在实力不俗的坎塔布里亚队与奥伦塞队之间展开激烈的较量。最终，实力更胜一筹的坎塔布里亚队凭借中国内线新星余嘉豪的出色发挥，以87-66毫无悬念地击败了奥伦塞队。值得一提的是，本场比赛中国内线新星余嘉豪在比赛中打成了大腿。据统计，此战余嘉豪首发出战20分钟，在进攻端5投4中且罚球4罚4中，一人独得12分4篮板的全面数据。经过了前4场比赛的低迷，余嘉豪终于在第五场比赛迎来了欧洲联赛中首次得分上双的壮举。 今夏休赛期，余嘉豪选择了放弃CBA联赛的高薪毅然决定了前往欧洲联赛练级。由于胡金秋已经在亚洲杯的比赛中打成了中国男篮第一内线，加上杨瀚森以首轮第16顺位在NBA选秀大会中被开拓者队拿下，这导致余嘉豪在中国男篮国家队的位置岌岌可危。在前国家队老大周琦还具备绝对统治力的情况之下，即将征战NCAA的中国U19男篮主力中锋郇斯楠的NBA前景已经非常乐观。在这样的情况之下，余嘉豪倘若继续选择在CBA联赛舒适区打球，那么未来基本无缘国家队的位置。 因此，余嘉豪选择了加盟西甲联赛更好地打磨自己的技术。但是，突如其来被下放到西乙联赛的余嘉豪遭遇到了巨大的打击，更重要的是其在前四场西乙联赛中表现低迷遭到了很多球迷的质疑。好在，余嘉豪也终于在第五场欧洲联赛中适应了比赛的节奏。与杨瀚森目前与开拓队战术体系格格不入且未来大概率会被下手放到NBA发展联盟相比，余嘉豪适应了西乙联赛之后必然能够更好地打磨自己的技术。而且，欧洲比赛的战术体系与FIBA接轨，也更加适合中国内线球员的发展与练级。 实际上，余嘉豪已经是继姚明后近20年内中国男篮最强的传统中锋，只是没有足够的内线技术支撑导致无法在当今更快的比赛节奏中发挥自己的优势。但是，余嘉豪目前已经开始融入西乙联赛的战术体系，未来有机会成为真正意义上的第一位“欧式中锋”。就目前中国男篮的人员配置来看，只有周琦与郇斯楠能够往美式内线发展。包括余嘉豪与杨瀚森等新星中锋，都更加适合成为欧洲风格的内线。因此，很多球迷预测余嘉豪在欧洲联赛打上主力可能会比杨瀚森在NBA联赛看饮水机更强。 综上所述，无论是余嘉豪还是杨瀚森都是中国男篮崛起的资本与筹码，两人分别前往NBA联赛与欧洲联赛也为国家队后续的新人提供了参考。倘若余嘉豪能够在欧洲联赛中打出自己的统治力，那么即便是杨瀚森最终无法立足于NBA联赛，中国男篮也有重返世界前八的机会。,2025-10-26 11:39:42,网易新闻,https://www.163.com/dy/article/KCPTVO2P05498TKN.html,2025-10-28 08:18:49,体育
中超第28轮，上海申花2:2大连英博,打开百度APP畅享高清图片 上海申花 vs大连英博 2:2 今晚的中超联赛第28轮，上海申花主场对阵大连英博，最终双方2:2战平。 上半场 本场比赛申花蒋圣龙累计4张黄牌停赛，金顺凯首发与朱辰杰搭档中卫，左边卫位置上，陈晋一回到首发，锋线组合是路易斯和阿苏埃。 上半场第25分钟，接到朱鹏宇分球，吕焯毅禁区外劲射得手，大连英博1:0取得领先。 之后，佩尼亚送出身后球，刘祝润左肋形成单刀推射破门，大连队将优势扩大为2:0。 半场结束前，吴曦禁区内突破后铲射破门，申花扳回一球。 下半场 全场补时阶段，经var提醒，主裁观看录像回放后判定大连队毕津浩禁区内撞倒吴曦犯规，申花获得点球。路易斯一蹴而就，申花将比分扳为2:2。 文：金雷 图：张龙 编辑：李纬、陆玮鑫 点击上图小程序 领取“乐动上海”体育消费券 小体推荐 2025世界赛艇锦标赛在沪闭幕，海内外赛艇健儿难忘上海时刻 跟着赛事游上海！2025“乐动上海”体育消费券（观赛类）等你来领 明早8点！快来领新一轮“乐动上海”健身类体育消费券（附全市定点场馆名单） 快来加入“小体朋友圈”，发现身边的“乐动上海”体育消费券定点场馆，健身享优惠！ 体育赛事方向！上海市商务高质量发展专项资金奖励（第二批次）开始申报啦 上海市体育健身行业合同示范文本发布，首批782家门店和场馆率先签署承诺书 为一场赛事赴一座城！2025年，跟着赛事游上海 小体声明 由于条件所限，可能出现未署名的原创图片或文字，在转载之前无法与权利人联系授权及稿酬事宜。欢迎权利人与编辑部联系署名授权、稿酬等事项。联系邮箱：shtyxxy@126.com 上观号作者：上海体育,2025-10-27 00:07:05,网易新闻,https://www.163.com/dy/article/KCR8OBAC055040N3.html,2025-10-28 08:18:53,体育
