title,content,publish_time,source,url,crawl_time,category
狂轰40+14+9+2+2，字母哥创2大NBA历史第1神迹！雄鹿无缘18分逆转,NBA常规赛雄鹿VS骑士 NBA常规赛激战正酣，雄鹿奔赴客场挑战骑士。克利夫兰在休赛期得到了朗佐鲍尔、小拉里南斯，实力大增，骑士被誉为新赛季能够冲出东部赛区的劲旅之一。密尔沃基虽然得到了科尔安东尼、科菲、加里哈里斯，以及迈尔斯特纳，但是雄鹿后卫线实力不足，整体攻防并不均衡。不过，扬尼斯阿德托昆博的存在，让雄鹿拥有了与联盟顶级豪强掰手腕的底气。两大东部劲旅，在此役展开了激战。 狂轰40+14+9+2+2，字母哥创2大NBA历史第1神迹！雄鹿无缘18分逆转！ 全场比赛回顾 首节开打，两队开场后很快进入状态，比分交替领先，但未能被拉开。字母哥率队打出了10比0的攻势，雄鹿取得微弱领先。克利夫兰多点开花，得以稳住局面。首节打完，雄鹿领先2分。 字母哥被包夹 次节较量，克利夫兰突然在外线找到手感，并将分差扩大至两位数。字母哥携手特纳率队追分，雄鹿里突外投追分。但是，密尔沃基无法限制对手的内外开火。半场打完，骑士反超9分，雄鹿单节以25比36落后。 易地再战，场上风云突变，骑士在进攻端持续发力，雄鹿在防守端顾此失彼。依靠着一波进攻狂潮，克利夫兰得以取得18分的领先优势。 字母哥在场上防守 不过，雄鹿并没有放弃追分。字母哥率先挺身而出，他在禁区肆虐的同时，还有外线远投命中。密尔沃基迅速起势，并回敬了25比2的冲击波。进入末节之前，雄鹿以84比86落后。 末节决战，两队陷入缠斗，在字母哥的率领之下，雄鹿一度抹平了分差，并看到了逆转取胜的希望。沉沦已久的米切尔，忽然站出来接管比赛，他连续利用冲击力取分，骑士稳住了局面。字母哥率队苦苦追分，但无奈时间所剩不多。最终，雄鹿以113比118惜败对手，无缘18分逆转。 雄鹿惜败骑士，无缘18分逆转 两队数据 骑士队，加兰、斯特鲁斯伤停， 米切尔20中9，三分球8中1得到了24分3板4助、莫布里13中5，三分球5中1得到了23分8板6助3断2帽、梅里尔17分3板1助、亨特16分4板2助、鲍尔7中4贡献11分6板5助、阿伦8分11板1助、小南斯5分5板1助、克雷格波特5分3板1助3断、泰森5分1助、韦德4分1板1助。 雄鹿队，AJ-格林9中6，三分球7中4得到了20分2板2助、罗林斯11中5得到了14分4板8助3断、特纳12中5，三分球6中2得到13分6板2助2帽、波蒂斯10中4得到了10分8板1助、普林斯8分3板1助3断、特伦特6分2助2断、希姆斯2分，库兹马、科尔安东尼、小凯文波特伤停。 狂轰40+14+9+2+2，字母哥创2大NBA历史第1神迹 雄鹿队超级巨星扬尼斯阿德托昆博，在此战拼尽全力。字母哥在登场33分钟的时间里，20投14中，三分1中1、罚球16中11，狂轰40分14篮板9助攻2抢断2盖帽的超级准三双数据。字母哥以70%的极高命中率，轰下了全场的最高分。并且，字母哥有着100%的命中率。作为此役走上罚球线次数最多的球员，字母哥有着69%的不俗罚球命中率。 字母哥冲击禁区 作为此役的篮板王、盖帽王和助攻王，字母哥在防守端和串联球队方面，也有着巨大的贡献。并且，字母哥送出了全场第二多的抢断。同时，字母哥的5个前场篮板领跑两队。面对贾莱特阿伦、小莫布里、小南斯组成的骑士队强力内线群，字母哥在禁区不断肆虐，并且在防守端存在感极强。字母哥已经倾其所有，他帮助雄鹿将胜负悬念维持到了最后。无力上演18分逆转神迹，字母哥只能饮恨。 字母哥已经尽力了，可谓是虽败犹荣。此役，字母哥还创下了2大NBA历史第1神迹。第1、常规赛赛季前3场，字母哥一共砍下108分48篮板21助攻，场均轰下36分16板7助。据统计，字母哥成为NBA历史首位在赛季前三战场均砍下35+15+5的球员。 莫布里防守字母哥 第2、字母哥成为历史上首位前三场至少拿到100分、40篮板、15助攻的球员。 创下了两大NBA历史第1纪录，足以证明字母哥的绝对实力。不得不说，字母哥依然是联盟里现役第一人的强力争夺者。只不过，整体实力不足以冲击总冠军的密尔沃基，能否在本赛季留下志向高远的字母哥，依然存在着巨大的不确定因素。,2025-10-27 15:47:18,网易新闻,https://www.163.com/dy/article/KCSUDEH40529GLQ2.html,2025-10-28 08:24:54,体育
两位超级外援被NBA裁员！登陆CBA将改变争冠格局，首钢能否拿下,班巴身体天赋非常出众，身高2米13，是NBA首轮六号秀，班巴一直没能兑现自己的天赋，但在魔术队效力的五个赛季，班巴一直都是球队的轮换球员。21-22赛季，班巴代表爵士出战71场常规赛，场均25.7分钟贡献10.6分8.1篮板1.7盖帽，这是他在NBA表现最佳的一个赛季。班巴虽然不是顶级内线，但他拥有出色的运动能力，护框和篮板球表现出色， 篮下终结也很稳定，对于渴望提升内线实力的球队而言，签下班巴也是不错的选择。 CBA这个休赛期比较漫长，因为全运会和男篮的比赛，CBA新赛季要到12月份才正式开打。对于很多球队而言，也拥有足够的时间来挑选合适的外援，像首钢、山西等队还在寻找优质外援，四外援的配置还没有凑齐。这个休赛期，曾有不少NBA级球员与CBA传出绯闻，包括威少、奥拉迪波，但这两名球星只考虑打NBA，现如今有希望转战CBA的大牌外援只有丁威迪和班巴，丁威迪已经被黄蜂队裁掉，班巴也被爵士队裁掉。从CBA新赛季的争冠形势来看，如果班巴和丁威迪能够加盟联盟前四级别的球队，势必会影响争冠格局。 丁威迪今年只有32岁，是NBA二轮秀，身高1米96，是NBA最励志的球员之一，曾凭借自己的努力从边缘球员打成队内主力，还拿到过三年6200万美元的大合同。19-20赛季是丁威迪的巅峰时期，场均可以贡献20.6分6.8助攻3.5篮板，之后转战独行侠之后，丁威迪也曾有过辉煌的成绩，连续两个赛季场均交出16+4+4数据，但在伤病的困扰下，丁威迪依旧没能在NBA立足，辗转篮网、湖人和独行侠之后，丁威迪还是没能逃脱被裁的命运。 从个人能力来看，多次遭遇职业生涯大伤的丁威迪已经不适合在NBA继续征战，但是以他的能力在CBA联赛打球，完全可以打出顶级外援的影响力，而且丁威迪还是中国某运动品牌的代言人，CBA很有可能是他的下一站。对于CBA一些争冠球队而言，如果能够大手笔签下丁威迪，肯定会改变新赛季的争冠走势。 班巴曾收到CBA俱乐部的高额报价，税前薪资超过300万美元，但班巴最终选择加盟爵士队，但非常遗憾的是，班巴在代表爵士队出战一场季前赛之后就被裁掉，这对于渴望签下班巴的CBA球队而言，再次看到了补强良机。 从新赛季冲冠球队的阵容来看，也只有首钢、上海、山西这三支球队具备签约丁威迪和班巴的能力，无论哪支球队引进这两位大牌外援，都将打乱新赛季的格局。,2025-10-19 16:58:17,网易新闻,https://www.163.com/dy/article/KC8F267V0549767M.html,2025-10-28 08:24:56,体育
马卡：巴萨更衣室有问题，缺少普约尔那样的领袖来劝诫亚马尔,雷速体育10月27日讯 西班牙《马卡报》在最新的报道中指出，巴萨的更衣室出了问题，而问题的根源并不在亚马尔身上。这个孩子才刚满18岁，职业生涯才刚刚起步，未来还有大把机会去追逐梦想。真正的问题在于：球队缺少真正的领袖。 巴萨需要那种有威信、有担当的球员——他们一开口，全队都会安静倾听；他们敢于在关键时刻站出来，哪怕话说得再重，年轻球员也会低头反思、认真吸取教训。每个人成长的过程中，都需要有人及时拉一把、点醒一下。可过去这一周，巴萨偏偏就缺了这样一个人。这种领导力的缺失，最终让球队付出了代价。 现在，身穿10号球衣的亚马尔给人的感觉是，俱乐部已经把“绝对权力”交到了他手里——仿佛他可以凌驾于规则之上，不受任何约束。对一个18岁的年轻人来说，这种处境极其危险。这一周，外界一直期待更衣室里能有人站出来，严肃地指出他的不当言行。可大家看到的却是纵容、辩解，甚至是一种“你做什么都没事”的纵容氛围。这种风气，对谁都没有好处。如果一个少年犯了错却没人敢管，那等他长大后，问题只会越来越严重。 这时候，真正的领袖价值就体现出来了。在一个以年轻人为主的更衣室里，队长不能只是个挂名的袖标，而应该是全队的“主心骨”和“方向盘”。说到这一点，没人比普约尔更清楚。毫无疑问，如果他是现在的队长，一定会在第一时间制止这一切。一个不合时宜的庆祝动作、一句冲动的发言、一次情绪化的反应……普约尔总能在事情变糟之前，私下、冷静但坚定地处理好。如果亚马尔身边有这样一位领袖，他或许会少一些冲动，多一些清醒；少走弯路，也笑得更踏实。,2025-10-27 20:38:11,网易新闻,https://www.163.com/dy/article/KCTF6HKR0529DS7F.html,2025-10-28 08:24:58,体育
五连胜到四连败！利物浦1.3亿镑新援哑火，斯洛特陷入信任危机,利物浦的问题其实在上赛季就存在，但是斯洛特依靠出色的临场调整弥补了球队进攻不足的难题，拖到本赛季初，利物浦的火力已经下滑得非常严重，为了解决球队的火力不足恐惧症，斯洛特甚至排出一套424的阵型，但还是无法解决进攻乏力的弊病，最终让利物浦的联赛连败场次来到4场，输给布伦特福德之后，高层也对斯洛特忍无可忍，下一场比赛若是不做出改变，他可能真的要下课了。 比起迟迟没能迎来英超首球的维尔茨，伊萨克和弗林蓬才是最惨的，弗林蓬是来到利物浦之后一直受伤，从没踢过全场比赛，虽然表现尚可，却还是无法恢复到最佳状态，如今弗林蓬甚至因为断断续续的出场导致伤情加重，在这一点上斯洛特表现地极为业余，这才导致球队的攻防两端出现严重下滑。 至于伊萨克，他完全就是没有融入利物浦，甚至利物浦根本就没有想过以他为核心打造战术，这才导致伊萨克的处境极为尴尬，在阵地战的过程中没有可靠的传中手，萨拉赫和加克波频繁内切突破打门，没有人帮助维尔茨分担组织进攻的重任，甚至都没人来接球，对于这样的情况，完全是斯洛特的战术安排不妥当。 伊萨克作为上赛季的英超银靴，他的实力丝毫不弱于埃基蒂克，只是因为球队没有人和他打配合，才导致伊萨克成了利物浦阵中最贵而且处境最尴尬的那个。造成伊萨克无法找到状态的根本原因，就是利物浦这几年一直是以边路为进攻核心，他们根本没有给伊萨克传球的意识，甚至只把伊萨克当前场的支点，甚至还要分出伊萨克的开火权，加上伊萨克本来就在英超踢球，大部分英超后卫都明白如何防守他，所以伊萨克想进球难如登天。 转会费1.3亿镑的伊萨克在今年夏天的确因为缺少训练导致状态不佳，在国家队的状态也受到影响，但是经过这一个多月的加练，伊萨克的体能状况已经有所好转，看看他在纽卡时期的表现就明白了——他从来不是传统中锋，而是需要空间完成冲刺的现代全能型前锋，斯洛特却总让他背对球门争顶，这就像让短跑选手去跑马拉松。当利物浦边路球员一次次内切浪射时，伊萨克只能在禁区里看着队友挥霍机会。 更讽刺的是，利物浦当初签下伊萨克，看中的正是他反击中的速度和门前嗅觉。如今球队却执着于阵地战，而斯洛特却将用在埃基蒂克身上的那套打法来使用伊萨克，继续这样生搬硬套，毁掉的不只是伊萨克的状态，更是利物浦整个进攻体系的持久力。 现在留给斯洛特的时间不多了，要么立即调整战术解放伊萨克，激活维尔茨的创造力；要么就只能带着抄袭渣叔的标签离开安菲尔德。毕竟在这里没有人会容忍既输球又毁掉的草包教练。,2025-10-27 23:43:07,网易新闻,https://www.163.com/dy/article/KCTNC0K7054953UN.html,2025-10-28 08:25:00,体育
单场20分！辽宁2.15米新神塔大爆发 能接班韩德君？,全运会热身赛，辽宁男篮106-77山东男篮。相对于大胜，辽宁男篮更大的收获还是张陈治峰的爆发，他拿到了20分。能在山东男篮内线予取予求，是因为张陈治峰有实力，早在青年队时期就打出了高水准。 2024年全国U21锦标赛，对阵新疆男篮的一场比赛，张陈治峰让对手见识了自己的厉害。2.15米的张陈治峰能在内线单打，对手难以防守。球性好，张陈治峰还能持球突破，面筐也很有杀伤力。还能把各项进攻技术结合起来，张陈治峰攻得风生水起，全场砍下25分。值得一提的是，张陈治峰还具备中远投能力，当届赛事还曾投进三分。 也能利用杀伤力为队友创造机会，张陈治峰的传球视野相当好。这场比赛，张陈治峰遭遇双人包夹时，余光看到底角队友，抬手就是一个长传。队友接球，手起刀落，命中三分。在一次拿球进攻时，就要出现失误时，电光火石间，张陈治峰注意到篮下的队友，把球传了出去。当时队友无人能防，接球轻松打进。 在保护篮板与防守上，张陈治峰也做得很好。抢下9个篮板，张陈治峰还送出3次盖帽，让对手胆寒。如今全运会热身赛上爆发，也只是张陈治峰优秀的一贯延续，也是辽宁男篮所需要的。 休赛期，韩德君宣布退役，辽宁男篮内线实力锐减。韩德君身高2.15米，在辽宁男篮当了多年的内线核心，帮球队拿了4个CBA总冠军。因为在CBA打得有声有色，韩德君还多次入选中国男篮。韩德君不可或缺，辽宁男篮也曾一直为他寻找接班人，但迟迟未找到。 2020-21赛季，朱荣振曾以租借的形式加盟辽宁男篮，担当韩德君的替补。初来乍到，朱荣振就爆发了，有过连续3场5次盖帽。进攻端也有亮眼表现，朱荣振单场有过21分。朱荣振展现出了接班韩德君的潜力，但因为山东男篮不放人，此事作罢。 张陈治峰也有接班韩德君的潜力，更为重要的是，张陈治峰还是辽宁男篮自己的球员。随着韩德君的退役，张陈治峰新赛季势必会受重用，打出高水准是可以期待的事情。辽宁男篮也需要张陈治峰的爆发，因为有了新顶级内线，球队就又有机会冲冠了。,2025-10-20 08:21:57,网易新闻,https://www.163.com/dy/article/KCA49DH20529EIN4.html,2025-10-28 08:25:02,体育
传奇落幕！卡森时隔18年，两夺欧冠，利物浦奇迹见证者，全部退役,这几天，斯科特•卡森宣布退役，这名刚刚年满40岁的英格兰老门将，结束了自己的职业生涯。卡森可谓是人生的赢家，足球故事十分传奇，不到20岁就跟随利物浦获得欧冠的冠军，随后在英格兰代表队成为出局“背锅侠”，想不到的是，18年后还有机会再次捧起欧冠的奖杯，并且成为历史上，首位可以在同一场地两夺欧冠的球员。 卡森是利兹联的青训球员，不到20岁就以75万英镑的转会费来到利物浦，跟“表演型”门将杜德克竞争首发位置。第一个赛季，也就是2004-2005赛季，虽然卡森没有在欧冠决赛出场，不过一直在场边看着杜德克用搞怪的动作，扑出AC米兰的点球，最终完成了大逆转，夺得欧冠的冠军，同时收获了冠军的奖牌。 看着当时双方的首发和替补，包括现任皇马主帅阿隆索，现任意大利主帅加图索，传奇射手舍甫琴科，传奇队长马尔蒂尼，还有杰拉德、卡拉格、卡卡、皮尔洛、内斯塔、卡福、斯塔姆等一众知名球星。随着当时相当年轻的卡森宣布挂靴，利物浦在伊斯坦布尔创造奇迹的两队所有见证者，已经全部退役。 随后，卡森短暂成为英格兰的一员，欧洲杯预选赛末轮面对克罗地亚的比赛中，英格兰2-3不敌对手，最终无缘欧洲杯正赛。竖日，时任主帅麦克拉伦下课，外界批评，这名弗格森的助手，不应该使用年轻的门将。缺乏经验，需要为失球负责的卡森，顿时成为英格兰出局的“背锅侠”之一。后来，卡森虽然被卡佩罗再次召入英格兰，始终无法找到主力位置，只代表英格兰参加了4场比赛。 在英格兰失意，在利物浦也失意，难以跟取代欧冠英雄杜德克的雷纳竞争，卡森只能频频租借，最终离开了安菲尔德，在土超和多支英格兰中下游球队不断徘徊。 在职业生涯末期，卡森再次加盟英超顶级豪门，并且代表曼城又一次闯进欧冠的决赛，一球小胜国际米兰，获得队史首座欧冠奖杯，这次夺冠，跟上一次捧起奖杯，整整过去了18年。 巧合的是，两夺欧冠，都是在伊斯坦布尔，卡森也成为欧冠历史上，唯一在同一场地两次获得冠军的球员。相同的是，卡森都在替补席上，观看了整场比赛。不同的是，第一个冠军，落后三球，连扳三球，是欧冠史上的奇迹，卡森还不到20岁。第二个冠军，凭借罗德里的一锤定音，不需要奇迹的帮忙，卡森已经接近40岁。 统计表明，卡森在曼城的6年时间里，一共只有2次出场机会，却随队获得4个英超冠军，加上欧冠和杯赛等赛事，合计取得12个冠军，可谓是人生的赢家，在退役之前能够留在如日中天的曼城，是一种幸运。 宣布挂靴后，卡森表示，在球门之间，经历了许多不可思议的旅程，足球给自己留下难忘的回忆，还有真挚的友谊，感谢每一名队友、教练、球迷和所属的俱乐部。现在，是时候脱下门将的手套了。租借离开曼城的格拉利什，也在社交媒体送出祝福，祝愿这名传奇结束了足球生涯，最好的兄弟一切顺利。 初期加盟利物浦，末期加盟曼城，一头一尾两次欧冠，还有大大小小的冠军，可以用人生的赢家来形容，“躺冠”也许是足球世界的特色，像阿扎尔，就是其中的佼佼者。不过，对于门将来说，很难用“躺”这个字来形容，毕竟在比赛中，门将一直需要在替补席上候命，随时准备出场，一点都不能放松，从某种意义上来看，甚至比出场的球员，还要在精神上高度集中。 如同卡森的回忆，代表曼城面对葡萄牙体育的欧冠16强次回合比赛中，第73分钟临危受命，替补埃德森出场，随后做出了精彩的扑救，实在太棒了，当时真的不知道发生了什么，有点震惊。有趣的是，看看卡森换下埃德森的瞬间，作为背景板，竖起大拇指的主教练是谁？ 门将是足球场上很特别的位置，即使是替补球员，也是相当重要的。40岁离开心爱的球场，足球给了自己一切，就是最真实的写照。,2025-10-27 18:27:31,网易新闻,https://www.163.com/dy/article/KCT7EJFA0529J1SF.html,2025-10-28 08:25:04,体育
陕西联合祝贺辽宁铁人冲超：期待贵俱乐部在中超继续发挥优异,北京时间10月27日，陕西联合俱乐部向本赛季中甲冠军辽宁铁人俱乐部发送了贺信。 贺信 辽宁铁人足球俱乐部： 欣闻贵俱乐部在2025赛季中甲联赛第28轮赛后，以64个积分的优异成绩提前锁定本赛季中甲联赛冠军以及下赛季中超联赛参赛资格！ 在此，陕西联合足球俱乐部向辽宁铁人足球俱乐部全体教练员、运动员、工作人员及球迷，表达由衷的祝贺！ 期待贵俱乐部在下赛季中超联赛中，能够继续发挥优异表现，为中国职业足球顶级联赛增添更多精彩瞬间！同时也期待未来贵我两俱乐部能够在各赛事平台深化交流，以足球为纽带传递体育精神，携手为中国足球事业的发展贡献力量！ 陕西联合足球俱乐部 2025年10月26日,2025-10-27 10:30:08,网易新闻,https://www.163.com/dy/article/KCSCD6880549BAP0.html,2025-10-28 08:25:06,体育
西海岸中卫里切利单场24次解围赛季中超最多，并刷新队史纪录,北京时间10月26日，在中超第28轮的比赛中，青岛西海岸在一度两球领先的情况下，最终遭遇成都蓉城的补时绝平，主场2-2战平对手。此战西海岸的巴西中卫里切利首发打满了全场，并在解围这一项数据上刷新了纪录。 赛后根据Opta的统计，现年27岁的里切利本场比赛一共完成了多达24次解围，这刷新了青岛西海岸球员中超单场比赛的解围次数的队史纪录，同时也是本赛季至今中超联赛单场的解围次数纪录。,2025-10-27 09:47:11,网易新闻,https://www.163.com/dy/article/KCS9UHO50549BAP0.html,2025-10-28 08:25:09,体育
第二届CBA俱乐部杯分组出炉 山东高速男篮与青岛男篮同组,"用微信扫码二维码 分享至好友和朋友圈 特别声明：以上内容(如有图片或视频亦包括在内)为自媒体平台“网易号”用户上传并发布，本平台仅提供信息存储服务。 Notice: The content above (including the pictures and videos if any) is uploaded and posted by a user of NetEase Hao, which is a social media platform and only provides information storage services. 海星旅行 2025-10-27 17:08:25 麦芽看世界 2025-10-28 03:22:50 懂球社 2025-10-28 00:06:40 孤影来客 2025-10-27 23:14:02 篮球快餐车 2025-10-28 03:15:22 一个香蕉说球 2025-10-26 08:57:57 DoubleZero 2025-10-27 18:35:30 皮皮观天下 2025-10-28 05:08:51 老贃是个手艺人 2025-10-26 02:02:07 篮球大陆 2025-10-27 19:27:57 篮球快餐车 2025-10-28 03:10:31 宁歌话健康运动 2025-10-27 06:39:53 人间百态中的温馨 2025-10-27 05:16:51 DoubleZero 2025-10-26 16:24:33 老钑爱看剧 2025-10-25 17:47:32 科技酷玩仓 2025-10-25 10:02:25 菅以蕊 2025-10-27 17:01:39 征垣之路 2025-10-27 09:51:36 毒舌小贝 2025-10-28 05:23:42 草莓信箱 2025-10-27 16:26:02 携手游人间a 2025-10-27 00:39:46 DoubleZero 2025-10-26 23:03:01 依偎在角落 2025-10-26 23:37:30 依偎在角落 2025-10-26 18:13:00 老贃是个手艺人 2025-10-27 22:14:56 老糿尾声体育解说 2025-10-28 02:04:52 食光捕趣人 2025-10-27 00:43:26 李杻手工制作 2025-10-28 02:10:53 DoubleZero 2025-10-27 21:58:54 篮球快餐车 2025-10-28 03:18:31 李杻手工制作 2025-10-28 02:05:02 两心相忆f 2025-10-28 01:18:42 爱体育 2025-10-28 00:07:54 热辣食尚官 2025-10-28 04:00:27 818体育 2025-10-27 21:51:39 懂球帝 2025-10-28 00:20:09 上游新闻 2025-10-26 15:21:37 封面新闻 2025-10-27 16:44:18 卿何薄命l 2025-10-27 08:16:26 刘姚尧的文字城堡 2025-10-28 07:18:26",2025-10-25 14:33:17,网易新闻,https://www.163.com/dy/article/KCNLGUUH0514CFC7.html,2025-10-28 08:25:12,体育
